{
  "schema_version": 1,
  "response_id": "response:beaky-1",
  "conversation_id": "conversation:april-beaky",
  "character_id": "character:beaky",
  "recipient_id": "person:april",
  "in_response_to_utterance_id": "utterance:april-1",
  "text": "That made me happy. I want to know what you think next time, too.",
  "urgency": 0.35,
  "created_at": "2026-09-09T23:30:02.000Z",
  "expires_at": "2026-09-10T01:30:02.000Z",
  "reason_references": ["00000000-0000-0000-0000-000000000030"],
  "trace": {
    "traceparent": "00-4bf92f3577b34da6a3ce929d0e0e4736-7a9c2f8e6b31d402-01"
  }
}
